{"$id":"https://single-image-studio.invalid/research/slice-11/schemas/definition-index.slice11.v0.schema.json","$schema":"https://json-schema.org/draft/2020-12/schema","additionalProperties":false,"properties":{"candidateRef":{"additionalProperties":false,"properties":{"byteLength":{"minimum":1,"type":"integer"},"contentHash":{"pattern":"^[a-f0-9]{64}$","type":"string"},"fileSha256":{"pattern":"^[a-f0-9]{64}$","type":"string"},"id":{"pattern":"^[A-Za-z0-9][A-Za-z0-9._:@/-]{2,199}$","type":"string"},"path":{"maxLength":200000,"minLength":1,"type":"string"}},"required":["path","id","contentHash","byteLength","fileSha256"],"type":"object"},"contentHash":{"pattern":"^[a-f0-9]{64}$","type":"string"},"contractRefs":{"items":{"additionalProperties":false,"properties":{"byteLength":{"minimum":1,"type":"integer"},"contentHash":{"pattern":"^[a-f0-9]{64}$","type":"string"},"fileSha256":{"pattern":"^[a-f0-9]{64}$","type":"string"},"id":{"pattern":"^[A-Za-z0-9][A-Za-z0-9._:@/-]{2,199}$","type":"string"},"path":{"maxLength":200000,"minLength":1,"type":"string"}},"required":["path","id","contentHash","byteLength","fileSha256"],"type":"object"},"maxItems":2,"minItems":2,"type":"array"},"counts":{"additionalProperties":false,"properties":{"applicableSources":{"const":48},"copiedImageBytes":{"const":0},"goldIdentities":{"const":48},"manifests":{"const":4},"plannedAttempts":{"const":288},"rejectionSources":{"const":48},"sourceWrappers":{"const":96},"sources":{"const":96}},"required":["applicableSources","copiedImageBytes","goldIdentities","manifests","plannedAttempts","rejectionSources","sourceWrappers","sources"],"type":"object"},"definitionState":{"const":"definition-frozen-results-zero"},"descendantFileCount":{"minimum":1,"type":"integer"},"descendantTreeSha256":{"pattern":"^[a-f0-9]{64}$","type":"string"},"evidenceBoundary":{"additionalProperties":false,"properties":{"c1":{"const":0},"e1":{"const":0},"formalEvidence":{"const":false},"g1":{"const":0},"o1":{"const":0},"productSupport":{"const":false},"r1Pipeline":{"const":0},"r1ProductRelease":{"const":0},"r1ProductValidation":{"const":0},"releaseAllowlist":{"const":"none"},"releaseApproved":{"const":0},"releaseRegistered":{"const":0},"u1":{"const":0},"v1":{"const":0}},"required":["c1","e1","formalEvidence","g1","o1","productSupport","r1Pipeline","r1ProductRelease","r1ProductValidation","releaseAllowlist","releaseApproved","releaseRegistered","u1","v1"],"type":"object"},"formalHoldoutState":{"const":"not-created"},"frozenAt":{"format":"date-time","type":"string"},"generatorSha256":{"pattern":"^[a-f0-9]{64}$","type":"string"},"goldIdentityRefs":{"items":{"additionalProperties":false,"properties":{"byteLength":{"minimum":1,"type":"integer"},"contentHash":{"pattern":"^[a-f0-9]{64}$","type":"string"},"fileSha256":{"pattern":"^[a-f0-9]{64}$","type":"string"},"id":{"pattern":"^[A-Za-z0-9][A-Za-z0-9._:@/-]{2,199}$","type":"string"},"path":{"maxLength":200000,"minLength":1,"type":"string"}},"required":["path","id","contentHash","byteLength","fileSha256"],"type":"object"},"maxItems":48,"minItems":48,"type":"array"},"id":{"pattern":"^[A-Za-z0-9][A-Za-z0-9._:@/-]{2,199}$","type":"string"},"lineageRef":{"additionalProperties":false,"properties":{"byteLength":{"minimum":1,"type":"integer"},"contentHash":{"pattern":"^[a-f0-9]{64}$","type":"string"},"fileSha256":{"pattern":"^[a-f0-9]{64}$","type":"string"},"id":{"pattern":"^[A-Za-z0-9][A-Za-z0-9._:@/-]{2,199}$","type":"string"},"path":{"maxLength":200000,"minLength":1,"type":"string"}},"required":["path","id","contentHash","byteLength","fileSha256"],"type":"object"},"manifestRefs":{"items":{"additionalProperties":false,"properties":{"byteLength":{"minimum":1,"type":"integer"},"contentHash":{"pattern":"^[a-f0-9]{64}$","type":"string"},"fileSha256":{"pattern":"^[a-f0-9]{64}$","type":"string"},"id":{"pattern":"^[A-Za-z0-9][A-Za-z0-9._:@/-]{2,199}$","type":"string"},"path":{"maxLength":200000,"minLength":1,"type":"string"}},"required":["path","id","contentHash","byteLength","fileSha256"],"type":"object"},"maxItems":4,"minItems":4,"type":"array"},"planRefs":{"items":{"additionalProperties":false,"properties":{"byteLength":{"minimum":1,"type":"integer"},"contentHash":{"pattern":"^[a-f0-9]{64}$","type":"string"},"fileSha256":{"pattern":"^[a-f0-9]{64}$","type":"string"},"id":{"pattern":"^[A-Za-z0-9][A-Za-z0-9._:@/-]{2,199}$","type":"string"},"path":{"maxLength":200000,"minLength":1,"type":"string"}},"required":["path","id","contentHash","byteLength","fileSha256"],"type":"object"},"maxItems":2,"minItems":2,"type":"array"},"readmeSha256":{"pattern":"^[a-f0-9]{64}$","type":"string"},"resultProtocol":{"additionalProperties":false,"properties":{"driverInvocations":{"const":1},"globalProtocolUncertaintyStopsAll":{"const":true},"ordinaryCompleteNonPassStopsOtherOperation":{"const":false},"plannedAttempts":{"const":288},"plannedSources":{"const":96},"registeredOperationRuns":{"const":2},"replacements":{"const":0},"resultsRoot":{"const":"results/open-calibration"}},"required":["driverInvocations","registeredOperationRuns","plannedSources","plannedAttempts","replacements","resultsRoot","ordinaryCompleteNonPassStopsOtherOperation","globalProtocolUncertaintyStopsAll"],"type":"object"},"resultsState":{"const":"not-created"},"rights":{"additionalProperties":false,"properties":{"modelWeights":{"const":false},"productUseAuthorized":{"const":false},"projectOriginalSyntheticOnly":{"const":true},"realUserPhotos":{"const":false},"thirdPartyImageAssets":{"const":false}},"required":["projectOriginalSyntheticOnly","realUserPhotos","thirdPartyImageAssets","modelWeights","productUseAuthorized"],"type":"object"},"runnerRef":{"additionalProperties":false,"properties":{"id":{"pattern":"^[A-Za-z0-9][A-Za-z0-9._:@/-]{2,199}$","type":"string"},"path":{"maxLength":200000,"minLength":1,"type":"string"},"sha256":{"pattern":"^[a-f0-9]{64}$","type":"string"}},"required":["path","id","sha256"],"type":"object"},"runtimeRef":{"additionalProperties":false,"properties":{"byteLength":{"minimum":1,"type":"integer"},"contentHash":{"pattern":"^[a-f0-9]{64}$","type":"string"},"fileSha256":{"pattern":"^[a-f0-9]{64}$","type":"string"},"id":{"pattern":"^[A-Za-z0-9][A-Za-z0-9._:@/-]{2,199}$","type":"string"},"path":{"maxLength":200000,"minLength":1,"type":"string"}},"required":["path","id","contentHash","byteLength","fileSha256"],"type":"object"},"schemaPaths":{"items":{"maxLength":200000,"minLength":1,"type":"string"},"maxItems":23,"minItems":23,"type":"array"},"schemaVersion":{"const":"definition-index.slice11.v0"},"sourceRefs":{"items":{"additionalProperties":false,"properties":{"byteLength":{"minimum":1,"type":"integer"},"contentHash":{"pattern":"^[a-f0-9]{64}$","type":"string"},"fileSha256":{"pattern":"^[a-f0-9]{64}$","type":"string"},"id":{"pattern":"^[A-Za-z0-9][A-Za-z0-9._:@/-]{2,199}$","type":"string"},"path":{"maxLength":200000,"minLength":1,"type":"string"}},"required":["path","id","contentHash","byteLength","fileSha256"],"type":"object"},"maxItems":96,"minItems":96,"type":"array"}},"required":["schemaVersion","id","frozenAt","definitionState","candidateRef","contractRefs","runtimeRef","lineageRef","planRefs","manifestRefs","sourceRefs","goldIdentityRefs","schemaPaths","runnerRef","resultProtocol","rights","counts","resultsState","formalHoldoutState","generatorSha256","readmeSha256","descendantFileCount","descendantTreeSha256","evidenceBoundary","contentHash"],"type":"object"}
