{"candidateRef":{"byteLength":3006,"contentHash":"7591599cd4f19883fe6d3f7f7fb3ae81aa54eddfa2a9607c7b04d2c40ffa2183","fileSha256":"570bb70690657269693200e4fb7bccc8efdc0adcb84633cbf4065f6f0432f2f1","id":"REG-NORM-SHARP-CANONICAL-PNG@0.11.0","path":"candidate-locks/canonical-png.v0.11.0.json"},"contentHash":"10676a4490d7019e56a65d683e2b29fd5ddc78bae155f54683d5e99ba2c33bba","contractRefs":[{"byteLength":1318,"contentHash":"df42ccc62581dcba9b686b3cc93714d83e83879f0befd9d505229f2a7ec620a4","fileSha256":"9656b8806e81c4ccfec6a82b1753697f33decbf693b64a73e64b8531f8a5f0a6","id":"CC-CAP02-NORMALIZE-PNG@0.11.0","path":"contracts/normalize-png.v0.11.0.json"},{"byteLength":1306,"contentHash":"005fbbd273eb2d4dc701c66ca166a40fa5385255c635e1868d19a57f2e35e0de","fileSha256":"b3b708f61c926018053810b6292429193c0b53ec534eed269cb99673c3c27546","id":"CC-CAP02-EXPORT-PNG@0.11.0","path":"contracts/export-png.v0.11.0.json"}],"counts":{"applicableSources":48,"copiedImageBytes":0,"goldIdentities":48,"manifests":4,"plannedAttempts":288,"rejectionSources":48,"sourceWrappers":96,"sources":96},"definitionState":"definition-frozen-results-zero","descendantFileCount":178,"descendantTreeSha256":"e5a9e69987eac7d178b58274e50606eacfe2a3e12ad1bf111ff9ccb1a4ae9b55","evidenceBoundary":{"c1":0,"e1":0,"formalEvidence":false,"g1":0,"o1":0,"productSupport":false,"r1Pipeline":0,"r1ProductRelease":0,"r1ProductValidation":0,"releaseAllowlist":"none","releaseApproved":0,"releaseRegistered":0,"u1":0,"v1":0},"formalHoldoutState":"not-created","frozenAt":"2026-08-15T23:01:50.529Z","generatorSha256":"7a622b4bc63e454463cac5dc24911b25b1152abb7252535515b6312085eb0b41","goldIdentityRefs":[{"byteLength":2188,"contentHash":"f55cddc7492cde4dd1ddd0f211e7c50018d6ddaa341ad11da4c3ff578f39f8f1","fileSha256":"fc170f06d65d2adc98b26528c44667906f896ad8a376e1bdb8db4c9a8399ccc2","id":"gold-identity.s11.normalize.dev.001","path":"gold-identities/normalize/dev-calibration/gold-identity.s11.normalize.dev.001.json"},{"byteLength":2189,"contentHash":"5735ba7a0e051b0dbdc4dfa00be486fe9355b7e95beceddc114f0c7d884d33c1","fileSha256":"52a06151484511ceaa9b6f7049f15d20c7579b1b6173a15cf972cc6135ed914d","id":"gold-identity.s11.normalize.dev.002","path":"gold-identities/normalize/dev-calibration/gold-identity.s11.normalize.dev.002.json"},{"byteLength":2189,"contentHash":"b999a2d518725b5c827df2a5c37b8acccf8434e813d617304e87486a77dcdccb","fileSha256":"a29742855ba4a9d4cd1a7cab37c6223debb17297957c9837035591e95fcacf45","id":"gold-identity.s11.normalize.dev.003","path":"gold-identities/normalize/dev-calibration/gold-identity.s11.normalize.dev.003.json"},{"byteLength":2189,"contentHash":"2df7024fbd3abd5ab37e5ecdcea559702e23df7e1e43ba4f6b94ee3fbead89dc","fileSha256":"84e15c1e50989d9c359a7fd6798166610e3279d5cbd1edc8882b502b3dcd1bb4","id":"gold-identity.s11.normalize.dev.004","path":"gold-identities/normalize/dev-calibration/gold-identity.s11.normalize.dev.004.json"},{"byteLength":2189,"contentHash":"e668f278b654114c250f32cdfbb5d568098fc6ff933161d1d155da3fbdfa33d1","fileSha256":"d5fd71182ec545fcafda917bb8546ec167ac112f350906b46f333ce6bac44877","id":"gold-identity.s11.normalize.dev.005","path":"gold-identities/normalize/dev-calibration/gold-identity.s11.normalize.dev.005.json"},{"byteLength":2189,"contentHash":"9a7698148147de447bed2626babc33a9ae64797aad06f24e213007f4b88da191","fileSha256":"19c97d3208a619970132d5395fd2d147a45872551b8260ef852ce8c13ec0c534","id":"gold-identity.s11.normalize.dev.006","path":"gold-identities/normalize/dev-calibration/gold-identity.s11.normalize.dev.006.json"},{"byteLength":2187,"contentHash":"0939207c2c3ee952f6b64d83df44175b24951b4e94caaaa9bcc125a1f9e57f62","fileSha256":"8190b1ea2d259924592ae33658998620fb7f0f6e7c156ced0261af2792945274","id":"gold-identity.s11.normalize.dev.007","path":"gold-identities/normalize/dev-calibration/gold-identity.s11.normalize.dev.007.json"},{"byteLength":2188,"contentHash":"45e589121ca4528acbf99c70c771d18f028ff6a9b367140f3994ff947442830b","fileSha256":"8501cf0cf3f369aa5b1da37bd89ae5e5ef9032b2381e2223ca4d1596046fed4d","id":"gold-identity.s11.normalize.dev.008","path":"gold-identities/normalize/dev-calibration/gold-identity.s11.normalize.dev.008.json"},{"byteLength":2187,"contentHash":"5f914c4e636f789d6dccbcfec476278abe334cdfb600710cab7e6fe05b047d69","fileSha256":"3622904856e35ad8da6db536f12c72b5e344a1b20a1e8f2e174c78bc975522ea","id":"gold-identity.s11.normalize.dev.009","path":"gold-identities/normalize/dev-calibration/gold-identity.s11.normalize.dev.009.json"},{"byteLength":2188,"contentHash":"e1e1c592e6416fbd956dd4fb109305969526464bb4b4d454859ff62fb67eac79","fileSha256":"92be142e4c02a2bc3519f55025163fe9579353f9f91a1fcb587797bded1799ab","id":"gold-identity.s11.normalize.dev.010","path":"gold-identities/normalize/dev-calibration/gold-identity.s11.normalize.dev.010.json"},{"byteLength":2187,"contentHash":"ae8b36f42da274bd05749305314f7c6273799eb7e23093610431f2bf071af5f2","fileSha256":"47b3c26cc644a7033514afe123c166ca819dc6ffce2f59131f71dceee4d2f95b","id":"gold-identity.s11.normalize.dev.011","path":"gold-identities/normalize/dev-calibration/gold-identity.s11.normalize.dev.011.json"},{"byteLength":2188,"contentHash":"2a213b7e668a1f51315cad5de240bb29858c861a95b85fc9ea1e3390929f81e3","fileSha256":"a298cdd1d94d18c3010dae7e434a0e1a0297cfd6865e3e74737355e7f2eb9f8b","id":"gold-identity.s11.normalize.dev.012","path":"gold-identities/normalize/dev-calibration/gold-identity.s11.normalize.dev.012.json"},{"byteLength":2187,"contentHash":"2fd04cf656bbfd5bfb66d6466cdde342e1c5d5202d1730dae61d194e15542999","fileSha256":"e2ba1deec6dd8ce099e778c42ff5590d230656ab4e9c58b79f0a501ee7fd8b77","id":"gold-identity.s11.normalize.dev.013","path":"gold-identities/normalize/dev-calibration/gold-identity.s11.normalize.dev.013.json"},{"byteLength":2187,"contentHash":"92dd05af9b2ad250e31c4258360ede659c77e692f181f7d0e45816cfecb6680e","fileSha256":"f8c255b7aadf84f650e53ec38099e536bc57307667e4f1206925991498f0d980","id":"gold-identity.s11.normalize.dev.014","path":"gold-identities/normalize/dev-calibration/gold-identity.s11.normalize.dev.014.json"},{"byteLength":2188,"contentHash":"e0b26ce7ca37a0f27e6ccc1d51dcb39a0970b196adddb3dc43c784c1ed7ae3fd","fileSha256":"438657ab7867cd8bf39e6ecca249528d7ad34a069b49b938db009a95d1a5c2f1","id":"gold-identity.s11.normalize.dev.015","path":"gold-identities/normalize/dev-calibration/gold-identity.s11.normalize.dev.015.json"},{"byteLength":2188,"contentHash":"0ec7d09a3dc33c26ea4bee641292b732fcb1c8d56633e2359e0b5cf902c8cc2c","fileSha256":"d14f0ef84049650c38e35ce815b52b40b84c93829b92b1d8eba91bc87a74478f","id":"gold-identity.s11.normalize.dev.016","path":"gold-identities/normalize/dev-calibration/gold-identity.s11.normalize.dev.016.json"},{"byteLength":2188,"contentHash":"335db7f975b56e37ac2d4c15cb62dd1500bcbffd770a78abcfe8774aedc55be0","fileSha256":"7d375a804482338d27838d93ae40e9f2a1ff263326409b65973e5999ee1015b1","id":"gold-identity.s11.normalize.dev.017","path":"gold-identities/normalize/dev-calibration/gold-identity.s11.normalize.dev.017.json"},{"byteLength":2188,"contentHash":"e48e8ec12eb98a8dc0fa15483312a8ea40e67e2fde44cbf5d076db30c37a7ec1","fileSha256":"29ee31cda3f710b0320d4334f22630582478909e125fff0dc81d33f42445031a","id":"gold-identity.s11.normalize.dev.018","path":"gold-identities/normalize/dev-calibration/gold-identity.s11.normalize.dev.018.json"},{"byteLength":2222,"contentHash":"ff8b2c3cc4ef3330daeabd5ac8a73476cbc13ec42aaac4feaa252abdb86e15ae","fileSha256":"f3e14cf72d21ec907063cb79c96b94cbe63f6c6501fdea5c7b9ac8aba78689d9","id":"gold-identity.s11.normalize.defect.001","path":"gold-identities/normalize/defect-calibration/gold-identity.s11.normalize.defect.001.json"},{"byteLength":2221,"contentHash":"60b99762200a696e0c65e6410adbb45597e68b08bf26cbad21c1580fc304cbd6","fileSha256":"9c9e37b33881b90c58f291d09fea3ccb425fef56de6f118a021722c0d52bc3e0","id":"gold-identity.s11.normalize.defect.002","path":"gold-identities/normalize/defect-calibration/gold-identity.s11.normalize.defect.002.json"},{"byteLength":2221,"contentHash":"fcc89cda0e8cef92412299b437eadcdfcf9fcc4f18b1a33afd14103f0dd7d566","fileSha256":"1fd78820141b35dee74bbeae5eed0a7b239030683233ab594b36eb3210de041d","id":"gold-identity.s11.normalize.defect.003","path":"gold-identities/normalize/defect-calibration/gold-identity.s11.normalize.defect.003.json"},{"byteLength":2221,"contentHash":"5fa6a655edf2621222fba8e1261d1ab7fb7786db19caa104eac7083df643d17c","fileSha256":"60388e18b32febdb57729b5efdb5daf8cc58ec1613c1659d1f6362132429e189","id":"gold-identity.s11.normalize.defect.004","path":"gold-identities/normalize/defect-calibration/gold-identity.s11.normalize.defect.004.json"},{"byteLength":2221,"contentHash":"1875b74548923aae9cbc462b552a2ecfead64b1b5bdd27303ab57e0c128d1d2e","fileSha256":"65e7383001bd2b0cc13b35f99fb3b674d8101a9d467b35825a2162a4cd70706a","id":"gold-identity.s11.normalize.defect.005","path":"gold-identities/normalize/defect-calibration/gold-identity.s11.normalize.defect.005.json"},{"byteLength":2221,"contentHash":"2cfc81f9f9728345ad9ba0419fa87fd7e6bb70612e0ff42a7e6876c3abb7f2a7","fileSha256":"35b6cad13b12cc434dd5cca228d2b9d6d9aa6ed5c095e53ca339487bf355d7a7","id":"gold-identity.s11.normalize.defect.006","path":"gold-identities/normalize/defect-calibration/gold-identity.s11.normalize.defect.006.json"},{"byteLength":2227,"contentHash":"1889644654e4ab833550495aa71325613c9511eb73db4e409d58660baf806909","fileSha256":"9d232a1f92a4d85895dc77306b776b0b1084df25ef0a90568e97114f1b349314","id":"gold-identity.s11.export.dev.001","path":"gold-identities/export/dev-calibration/gold-identity.s11.export.dev.001.json"},{"byteLength":2227,"contentHash":"85f11e2bfc8a5cbdb18f11b3af5b2c99b33dfae2b8370ffac646ac9f11cac26d","fileSha256":"e0a8096a11ec68ef184866fe4fb40e6da52b55df7e688b2811d6917fd471495c","id":"gold-identity.s11.export.dev.002","path":"gold-identities/export/dev-calibration/gold-identity.s11.export.dev.002.json"},{"byteLength":2227,"contentHash":"8e278d6791fbf609f22dedf5009bfb4df502f59833376df34fbef0